{
  "schema": "local-seo-brain.source-ledger.v1",
  "as_of": "2026-10-15",
  "notes": "Canonical evidence metadata. Web pages are not vendored; locators and dates are verified as of the pinned date.",
  "sources": [
    {
      "id": "google-search-essentials",
      "url": "https://developers.google.com/search/docs/essentials",
      "title": "Google Search Essentials (formerly Webmaster Guidelines)",
      "publisher": "Google Search Central",
      "date": null,
      "updated_at": "2025-12-10",
      "retrieved": "2026-10-15",
      "retrieved_at": "2026-10-15",
      "last_verified": "2026-10-15",
      "refresh_due": "2026-11-14",
      "source_type": "official-doc",
      "authority": "official",
      "review_state": "active",
      "independence_key": "google-search-central",
      "jurisdiction": "global",
      "payload_sha256": null,
      "raw_path": null,
      "supports_claims": [],
      "locator": "Technical requirements; spam policies; key best practices",
      "refresh_result": "unchanged"
    },
    {
      "id": "google-search-ranking-systems",
      "url": "https://developers.google.com/search/docs/appearance/ranking-systems-guide",
      "title": "A Guide to Google Search Ranking Systems",
      "publisher": "Google Search Central",
      "date": null,
      "updated_at": "2025-12-10",
      "retrieved": "2026-10-15",
      "retrieved_at": "2026-10-15",
      "last_verified": "2026-10-15",
      "refresh_due": "2026-11-14",
      "source_type": "official-doc",
      "authority": "official",
      "review_state": "active",
      "independence_key": "google-search-central",
      "jurisdiction": "global",
      "payload_sha256": null,
      "raw_path": null,
      "supports_claims": [
        "page-rank-no-fixed-model"
      ],
      "locator": "Link analysis systems and PageRank; retired systems",
      "refresh_result": "unchanged"
    },
    {
      "id": "google-helpful-content",
      "url": "https://developers.google.com/search/docs/fundamentals/creating-helpful-content",
      "title": "Creating Helpful, Reliable, People-First Content",
      "publisher": "Google Search Central",
      "date": null,
      "updated_at": "2026-10-05",
      "retrieved": "2026-10-15",
      "retrieved_at": "2026-10-15",
      "last_verified": "2026-10-15",
      "refresh_due": "2026-11-14",
      "source_type": "official-doc",
      "authority": "official",
      "review_state": "active",
      "independence_key": "google-search-central",
      "jurisdiction": "global",
      "payload_sha256": null,
      "raw_path": null,
      "supports_claims": [
        "eeat-trust-context",
        "generative-ai-content-quality",
        "no-universal-content-formula"
      ],
      "locator": "Expertise questions; Get to know E-E-A-T; Who, How, and Why; main content quality; no preferred word count",
      "refresh_result": "changed"
    },
    {
      "id": "google-core-updates",
      "url": "https://developers.google.com/search/docs/appearance/core-updates",
      "title": "Google Search Core Updates and Your Website",
      "publisher": "Google Search Central",
      "date": null,
      "updated_at": "2025-12-10",
      "retrieved": "2026-10-15",
      "retrieved_at": "2026-10-15",
      "last_verified": "2026-10-15",
      "refresh_due": "2026-11-14",
      "source_type": "official-doc",
      "authority": "official",
      "review_state": "active",
      "independence_key": "google-search-central",
      "jurisdiction": "global",
      "payload_sha256": null,
      "raw_path": null,
      "supports_claims": [
        "search-update-events"
      ],
      "locator": "Assessing a drop in position; self-assessment guidance",
      "refresh_result": "changed"
    },
    {
      "id": "google-search-spam-policies",
      "url": "https://developers.google.com/search/docs/essentials/spam-policies",
      "title": "Spam Policies for Google Web Search",
      "publisher": "Google Search Central",
      "date": null,
      "updated_at": "2026-08-28",
      "retrieved": "2026-10-15",
      "retrieved_at": "2026-10-15",
      "last_verified": "2026-10-15",
      "refresh_due": "2026-11-14",
      "source_type": "official-doc",
      "authority": "official",
      "review_state": "active",
      "independence_key": "google-search-central",
      "jurisdiction": "global",
      "payload_sha256": null,
      "raw_path": null,
      "supports_claims": [
        "accordions-allowed",
        "eea-site-reputation-enforcement",
        "hidden-and-doorway-abuse",
        "link-schemes-prohibited"
      ],
      "locator": "Scaled content abuse; hidden text and link abuse; link spam; doorway abuse",
      "refresh_result": "changed"
    },
    {
      "id": "google-march-2024-core-spam",
      "url": "https://developers.google.com/search/blog/2024/03/core-update-spam-policies",
      "title": "What Web Creators Should Know About Our March 2024 Core Update and New Spam Policies",
      "publisher": "Google Search Central Blog",
      "date": null,
      "updated_at": null,
      "retrieved": "2026-10-15",
      "retrieved_at": "2026-10-15",
      "last_verified": "2026-10-15",
      "refresh_due": "2026-11-14",
      "source_type": "first-party-blog",
      "authority": "official",
      "review_state": "active",
      "independence_key": "google-search-central",
      "jurisdiction": "global",
      "payload_sha256": null,
      "raw_path": null,
      "supports_claims": [],
      "locator": "March 2024 core update and new spam policies announcement",
      "refresh_result": "unchanged"
    },
    {
      "id": "google-site-reputation-update",
      "url": "https://developers.google.com/search/blog/2024/11/site-reputation-abuse",
      "title": "Updating Our Site Reputation Abuse Policy",
      "publisher": "Google Search Central Blog",
      "date": null,
      "updated_at": null,
      "retrieved": "2026-10-15",
      "retrieved_at": "2026-10-15",
      "last_verified": "2026-10-15",
      "refresh_due": "2026-11-14",
      "source_type": "first-party-blog",
      "authority": "official",
      "review_state": "active",
      "independence_key": "google-search-central",
      "jurisdiction": "global",
      "payload_sha256": null,
      "raw_path": null,
      "supports_claims": [],
      "locator": "Site reputation abuse policy update",
      "refresh_result": "superseded-in-part"
    },
    {
      "id": "google-search-status-summary",
      "url": "https://status.search.google.com/summary",
      "title": "Google Search Status Dashboard",
      "publisher": "Google Search Status Dashboard",
      "date": null,
      "updated_at": null,
      "retrieved": "2026-10-15",
      "retrieved_at": "2026-10-15",
      "last_verified": "2026-10-15",
      "refresh_due": "2026-10-22",
      "source_type": "official-doc",
      "authority": "official",
      "review_state": "active",
      "independence_key": "google-search-status",
      "jurisdiction": "global",
      "payload_sha256": null,
      "raw_path": null,
      "supports_claims": [
        "search-update-events"
      ],
      "locator": "Ranking update incident history",
      "refresh_result": "changed"
    },
    {
      "id": "google-search-doc-updates",
      "url": "https://developers.google.com/search/updates",
      "title": "Google Search Documentation Updates",
      "publisher": "Google Search Central",
      "date": null,
      "updated_at": "2026-10-08",
      "retrieved": "2026-10-15",
      "retrieved_at": "2026-10-15",
      "last_verified": "2026-10-15",
      "refresh_due": "2026-10-22",
      "source_type": "official-doc",
      "authority": "official",
      "review_state": "active",
      "independence_key": "google-search-central",
      "jurisdiction": "global",
      "payload_sha256": null,
      "raw_path": null,
      "supports_claims": [
        "faq-rich-results-ended"
      ],
      "locator": "Documentation change history",
      "refresh_result": "changed"
    },
    {
      "id": "google-ai-features",
      "url": "https://developers.google.com/search/docs/appearance/ai-features",
      "title": "AI Features and Your Website",
      "publisher": "Google Search Central",
      "date": null,
      "updated_at": "2025-12-10",
      "retrieved": "2026-10-15",
      "retrieved_at": "2026-10-15",
      "last_verified": "2026-10-15",
      "refresh_due": "2026-11-14",
      "source_type": "official-doc",
      "authority": "official",
      "review_state": "active",
      "independence_key": "google-search-central",
      "jurisdiction": "global",
      "payload_sha256": null,
      "raw_path": null,
      "supports_claims": [
        "ai-citation-formulas-unsupported",
        "ai-features-no-special-requirements"
      ],
      "locator": "How to appear in AI features; technical requirements; SEO best practices",
      "refresh_result": "unchanged"
    },
    {
      "id": "google-succeeding-ai-search",
      "url": "https://developers.google.com/search/blog/2025/05/succeeding-in-ai-search",
      "title": "Succeeding in AI Search",
      "publisher": "Google Search Central Blog",
      "date": null,
      "updated_at": null,
      "retrieved": "2026-10-15",
      "retrieved_at": "2026-10-15",
      "last_verified": "2026-10-15",
      "refresh_due": "2026-11-14",
      "source_type": "first-party-blog",
      "authority": "official",
      "review_state": "active",
      "independence_key": "google-search-central",
      "jurisdiction": "global",
      "payload_sha256": null,
      "raw_path": null,
      "supports_claims": [
        "ai-features-no-special-requirements"
      ],
      "locator": "Foundational SEO guidance for AI search experiences",
      "refresh_result": "unchanged"
    },
    {
      "id": "google-ai-optimization-resource-2026",
      "url": "https://developers.google.com/search/blog/2026/05/a-new-resource-for-optimizing",
      "title": "A New Resource for Optimizing Your Content for Google's AI Experiences",